{
  "$schema": "../style.schema.json",
  "name": "whiteboard",
  "label": "Whiteboard",
  "medium": "chisel dry-erase marker on melamine",
  "paper": {
    "texture": "whiteboard",
    "color": "#f6f7f4"
  },
  "ink": {
    "color": "#141414",
    "width": 3.6,
    "opacity": 0.96,
    "taper": 0.12,
    "grain": 0.04,
    "jitter": 0.4,
    "blend": "multiply"
  },
  "layers": {
    "detail": {
      "width": 0.75
    },
    "shade": {
      "width": 0.9,
      "opacity": 0.75,
      "speed": 0.6,
      "color": "#1f4fd8"
    }
  },
  "trace": {
    "detail": 0.5,
    "hatch": "zigzag",
    "hatchDensity": 0.35,
    "levels": 2,
    "background": "none",
    "vignette": 0.6
  },
  "pen": {
    "tool": "marker",
    "scale": 0.9
  },
  "color": {
    "reveal": "wash",
    "opacity": 0.85,
    "inkAfter": 1,
    "strength": 0.65
  },
  "sound": {
    "kind": "marker"
  },
  "sketch": {
    "lines": 1.15,
    "tone": 0.8,
    "hatchScale": 1.7,
    "strokeLines": 0.12,
    "band": 1.2
  }
}
